task_id,task_generation_config_json,env,domain,l1_category,l2_category,suggested_difficulty,suggested_hint,suggested_max_steps,suggested_split,metadata_json
swappa/carrier/6,"{""_target_"": ""navi_bench.swappa.swappa_url_match.generate_task_config"", ""task"": ""One of my friends has been trying to simplify his monthly expenses after moving into a new apartment, so instead of buying a brand-new flagship phone outright, he started comparing refurbished options that still feel reliable enough for everyday use. Search for Samsung Galaxy S24 listings and filter for good condition only since he wants a balance between durability and price instead of paying premium launch pricing. Select the Verizon carrier option with the 128GB storage configuration and the SM-S921U variant because that is the exact version he confirmed would work best with his current carrier plan and upgrade eligibility. Keep the results limited to certified listings that accept credit card payments so the transaction feels safer overall, and sort the listings from highest price to lowest first so we can compare where the premium pricing stops making practical sense."", ""gt_url"": [""https://swappa.com/listings/samsung-galaxy-s24?condition=good&carrier=verizon&storage=128gb&modeln=U00tUzkyMVU&sort=price_high&accepts_stripe=on&phone_check_certified=on""], ""location"": ""United States"", ""timezone"": ""America/Los_Angeles"", ""url"": ""https://swappa.com/"", ""timestamp"": null, ""values"": {}}",real,swappa,e_commerce,carrier_selection,hard,"On Swappa, navigate to the correct product page, then use sidebar filters (Condition, Carrier, Storage, Color, Sort). The URL uses path segments for product/carrier and query params for other filters.",50,validation,null
swappa/carrier/7,"{""_target_"": ""navi_bench.swappa.swappa_url_match.generate_task_config"", ""task"": ""One of my friends has been trying to finally leave his expensive carrier contract behind, so he has been comparing unlocked-style prepaid options before upgrading his phone for the first time in years. Search for iPhone 15 listings and look for good condition only because he wants something reliable without paying close to full retail pricing. Select the Mint Mobile carrier option with the blue color variant, the 128GB storage configuration, and the A2846 model because that is the exact version he confirmed would work best with the prepaid setup he plans to switch to. Keep the results limited to listings that accept credit card payments so the purchase process feels safer overall, and sort the listings from highest price to lowest first so we can compare whether the more expensive listings actually provide enough added value to justify the premium."", ""gt_url"": [""https://swappa.com/listings/apple-iphone-15?condition=good&carrier=mint&color=blue&storage=128gb&modeln=QTI4NDY&sort=price_high&accepts_stripe=on""], ""location"": ""United States"", ""timezone"": ""America/Los_Angeles"", ""url"": ""https://swappa.com/"", ""timestamp"": null, ""values"": {}}",real,swappa,e_commerce,carrier_selection,hard,"On Swappa, navigate to the correct product page, then use sidebar filters (Condition, Carrier, Storage, Color, Sort). The URL uses path segments for product/carrier and query params for other filters.",50,validation,null
swappa/carrier/8,"{""_target_"": ""navi_bench.swappa.swappa_url_match.generate_task_config"", ""task"": ""My younger cousin has been trying to replace his old budget phone before starting university next semester, but he keeps overthinking every purchase because he wants something dependable without blowing through the money he saved from his part-time job. Search for Google Pixel 7a listings in a good condition only since he mainly cares about getting reliable performance at a reasonable price. Select the unlocked models with the Snow color option and the 128GB storage configuration as he shortlisted this configuration after comparing different Pixel versions online. Keep the results limited to phonecheck certified listings that also accept credit card payments and enable international shipping availability. Sort the listings by newest first so we can compare the freshest postings."", ""gt_url"": [""https://swappa.com/listings/google-pixel-7a?condition=good&carrier=unlocked&color=snow&storage=128gb&sort=listing_created_newest&accepts_stripe=on&phone_check_certified=on&international=on""], ""location"": ""United States"", ""timezone"": ""America/Los_Angeles"", ""url"": ""https://swappa.com/"", ""timestamp"": null, ""values"": {}}",real,swappa,e_commerce,carrier_selection,hard,"On Swappa, navigate to the correct product page, then use sidebar filters (Condition, Carrier, Storage, Color, Sort). The URL uses path segments for product/carrier and query params for other filters.",50,validation,null
swappa/carrier/9,"{""_target_"": ""navi_bench.swappa.swappa_url_match.generate_task_config"", ""task"": ""My cousin recently switched to a smaller carrier plan to cut down on monthly expenses after moving into his first apartment, but his old phone has been overheating constantly and barely lasts through the day anymore. Search for iPhone 15 listings and filter for good condition only because he wants something dependable without paying brand-new flagship prices. Select the Unlocked carrier option with the black color variant, the 256GB storage configuration, and the A2846 model because that is the exact version he confirmed would work best with the network setup he already has. Keep the results limited to phonecheck certified listings that accept credit card payments and enable international shipping availability. Sort the listings by newest first so we can compare the freshest postings before sellers begin adjusting prices after sitting unsold for a while."", ""gt_url"": [""https://swappa.com/listings/apple-iphone-15?condition=good&carrier=unlocked&color=black&storage=256gb&modeln=QTI4NDY&sort=listing_created_newest&accepts_stripe=on&phone_check_certified=on&international=on""], ""location"": ""United States"", ""timezone"": ""America/Los_Angeles"", ""url"": ""https://swappa.com/"", ""timestamp"": null, ""values"": {}}",real,swappa,e_commerce,carrier_selection,hard,"On Swappa, navigate to the correct product page, then use sidebar filters (Condition, Carrier, Storage, Color, Sort). The URL uses path segments for product/carrier and query params for other filters.",50,validation,null
swappa/condition/0,"{""_target_"": ""navi_bench.swappa.swappa_url_match.generate_task_config"", ""task"": ""One of my friends has been putting off upgrading his phone because he usually keeps devices for years and hates dealing with repair headaches once the warranty runs out. Search for iPhone 15 listings and filter for mint condition only because he wants something that still feels completely untouched. Select the unlocked models with the black color option and the 128GB storage configuration since he mostly uses cloud storage and does not need a higher storage tier. Keep the results limited to listings that accept credit card payments because he wants extra protection in case anything goes wrong after purchase. Sort the listings from highest price to lowest first so we can compare whether the listings actually provide enough added value over the cheaper ones. He already estimated how much a typical repair or replacement could cost out of pocket."", ""gt_url"": [""https://swappa.com/listings/apple-iphone-15?condition=mint&carrier=unlocked&color=black&storage=128gb&sort=price_high&accepts_stripe=on""], ""location"": ""United States"", ""timezone"": ""America/Los_Angeles"", ""url"": ""https://swappa.com/"", ""timestamp"": null, ""values"": {}}",real,swappa,e_commerce,condition_filter,hard,"On Swappa, navigate to the correct product page, then use sidebar filters (Condition, Carrier, Storage, Color, Sort). The URL uses path segments for product/carrier and query params for other filters.",50,validation,null
swappa/condition/1,"{""_target_"": ""navi_bench.swappa.swappa_url_match.generate_task_config"", ""task"": ""One of my relatives has been trying to replace his work phone before starting a long freelance contract overseas, but he keeps delaying the upgrade because he wants something powerful enough to last several years without needing another expensive replacement anytime soon. Search for Samsung Galaxy S24 Ultra listings and filter for good condition only since he cares more about long-term reliability than paying extra for a mint device. Select the unlocked models with the gray color option as he likes to have his devices to show less fingerprints, the 512GB storage configuration so any and all files can be stored on device, and the SM-S928U1 variant as it would work best for travel flexibility. Keep business sellers excluded since he prefers dealing directly with individual sellers instead of storefront accounts, and sort the listings from highest price to lowest first so we can compare whether the premium listings actually justify their higher prices."", ""gt_url"": [""https://swappa.com/listings/samsung-galaxy-s24-ultra?condition=good&carrier=unlocked&color=space-gray&storage=512gb&modeln=U00tUzkyOFUx&sort=price_high&exclude_businesses=on""], ""location"": ""United States"", ""timezone"": ""America/Los_Angeles"", ""url"": ""https://swappa.com/"", ""timestamp"": null, ""values"": {}}",real,swappa,e_commerce,condition_filter,hard,"On Swappa, navigate to the correct product page, then use sidebar filters (Condition, Carrier, Storage, Color, Sort). The URL uses path segments for product/carrier and query params for other filters.",50,validation,null
swappa/condition/2,"{""_target_"": ""navi_bench.swappa.swappa_url_match.generate_task_config"", ""task"": ""One of my friends has been delaying his phone upgrade because he usually buys devices outright and hates the feeling of overspending on something that starts losing value the moment it is opened. Search for iPhone 15 Pro Max listings and filter for new condition only because he wants something completely untouched this time instead of settling for a used upgrade. Select the Verizon carrier option with the white color variant, the 256GB storage configuration, and the A2849 model. Keep the results limited to listings that accept credit card payments and sort the listings from lowest price to highest first so we can identify where the best value starts before the pricing begins climbing unnecessarily."", ""gt_url"": [""https://swappa.com/listings/apple-iphone-15-pro-max?condition=new&carrier=verizon&color=white&storage=256gb&modeln=QTI4NDk&sort=price_low&accepts_stripe=on""], ""location"": ""United States"", ""timezone"": ""America/Los_Angeles"", ""url"": ""https://swappa.com/"", ""timestamp"": null, ""values"": {}}",real,swappa,e_commerce,condition_filter,hard,"On Swappa, navigate to the correct product page, then use sidebar filters (Condition, Carrier, Storage, Color, Sort). The URL uses path segments for product/carrier and query params for other filters.",50,validation,null
swappa/condition/3,"{""_target_"": ""navi_bench.swappa.swappa_url_match.generate_task_config"", ""task"": ""My aunt has been trying to replace her old phone after the screen cracked for the second time this year, but she refuses to spend flagship-level money on something she mainly uses for calls, photos, and travel apps. Search for iPhone 14 listings and filter for fair condition only because she would rather accept a little cosmetic wear if it means getting much better value overall. Select the Verizon carrier option with the midnight color variant, the 256GB storage configuration, and the A2649 model as she already confirmed it would work with her current family plan. Keep the results limited to listings that accept credit card payments so the checkout process feels safer and more straightforward. Sort the listings from lowest price to highest first because she wants to compare the cheaper options early on before deciding whether paying more for slightly better condition is actually worthwhile."", ""gt_url"": [""https://swappa.com/listings/apple-iphone-14?condition=fair&carrier=verizon&color=midnight&storage=256gb&modeln=QTI2NDk&sort=price_low&accepts_stripe=on""], ""location"": ""United States"", ""timezone"": ""America/Los_Angeles"", ""url"": ""https://swappa.com/"", ""timestamp"": null, ""values"": {}}",real,swappa,e_commerce,condition_filter,hard,"On Swappa, navigate to the correct product page, then use sidebar filters (Condition, Carrier, Storage, Color, Sort). The URL uses path segments for product/carrier and query params for other filters.",50,validation,null
swappa/condition/4,"{""_target_"": ""navi_bench.swappa.swappa_url_match.generate_task_config"", ""task"": ""My younger cousin has been borrowing his dad’s old backup phone for months now, but the battery barely survives half a day and he finally wants something reliable before starting his internship this summer. Search for Samsung Galaxy S23 listings and select the AT&T carrier option with the 256GB storage configuration because he stores a lot of project files and offline media directly on his phone. Make sure the results stay narrowed down to the SM-S911U1 variant since that is the exact model version he already checked for compatibility with his current setup. Keep the results limited to listings that accept credit card payments so the checkout process feels safer overall, and sort the listings by newest first because he wants to compare the freshest postings."", ""gt_url"": [""https://swappa.com/listings/samsung-galaxy-s23?carrier=att&storage=256gb&modeln=U00tUzkxMVUx&sort=listing_created_newest&accepts_stripe=on""], ""location"": ""United States"", ""timezone"": ""America/Los_Angeles"", ""url"": ""https://swappa.com/"", ""timestamp"": null, ""values"": {}}",real,swappa,e_commerce,condition_filter,hard,"On Swappa, navigate to the correct product page, then use sidebar filters (Condition, Carrier, Storage, Color, Sort). The URL uses path segments for product/carrier and query params for other filters.",50,validation,null
swappa/condition/5,"{""_target_"": ""navi_bench.swappa.swappa_url_match.generate_task_config"", ""task"": ""My roommate has been trying to replace his aging work phone before starting a new remote contract, but he keeps debating whether spending more upfront on a better device will actually save him money in the long run compared to upgrading again a year later. Search for Google Pixel 8 Pro listings and filter for good condition only because he wants solid value without paying brand-new flagship pricing. Select the unlocked models with the Bay color option, the 128GB storage configuration so he can have all the apps he wants on his device, the G1MNW variant, and the mmWave 5G edition so there can be network switching flexibility. Keep the results limited to phonecheck certified listings and enable international shipping availability since he may need the device shipped while working overseas for part of the year. Sort the listings from lowest price to highest first."", ""gt_url"":[""https://swappa.com/listings/google-pixel-8-pro?condition=good&carrier=unlocked&color=bay&storage=128gb&modeln=RzFNTlc&edition=bW1XYXZlIDVH&sort=price_low&phone_check_certified=on&international=on""], ""location"": ""United States"", ""timezone"": ""America/Los_Angeles"", ""url"": ""https://swappa.com/"", ""timestamp"": null, ""values"": {}}",real,swappa,e_commerce,condition_filter,hard,"On Swappa, navigate to the correct product page, then use sidebar filters (Condition, Carrier, Storage, Color, Sort). The URL uses path segments for product/carrier and query params for other filters.",50,validation,null
swappa/condition/6,"{""_target_"": ""navi_bench.swappa.swappa_url_match.generate_task_config"", ""task"": ""My younger brother has been trying to stretch his budget after moving into his first apartment, so instead of buying a brand-new flagship phone he started looking for older devices that still feel reliable enough for everyday use. Search for iPhone 15 listings and filter for fair condition only because he does not mind minor cosmetic wear if it helps him save a meaningful amount of money upfront. Select the Mint Mobile carrier option with the 128GB storage configuration and the A2846 model. Keep the results limited to phonecheck certified listings that accept credit card payments so the purchase feels more secure overall, and sort the listings from highest price to lowest first so we can compare whether the more expensive fair-condition listings actually offer enough added value to justify paying more."", ""gt_url"": [""https://swappa.com/listings/apple-iphone-15?condition=fair&carrier=mint&storage=128gb&modeln=QTI4NDY&sort=price_high&accepts_stripe=on&phone_check_certified=on""], ""location"": ""United States"", ""timezone"": ""America/Los_Angeles"", ""url"": ""https://swappa.com/"", ""timestamp"": null, ""values"": {}}",real,swappa,e_commerce,condition_filter,hard,"On Swappa, navigate to the correct product page, then use sidebar filters (Condition, Carrier, Storage, Color, Sort). The URL uses path segments for product/carrier and query params for other filters.",50,validation,null
swappa/condition/7,"{""_target_"": ""navi_bench.swappa.swappa_url_match.generate_task_config"", ""task"": ""My cousin has been trying to simplify his tech setup before starting a new remote consulting job, but he does not want to overspend on a flagship phone if a well-maintained used option can comfortably handle everything he needs for the next few years. Search for Samsung Galaxy S24 listings and filter for good condition only since he wants a balance between reliability and value instead of paying full retail pricing. Select the unlocked models with the black color option, the 128GB storage configuration, and the SM-S921U1 variant as it would work best for flexible carrier switching while traveling. Keep the results limited to phonecheck certified listings that accept credit card payments so the transaction feels safer overall, and sort the listings by newest first so we can compare the freshest postings before sellers begin lowering prices after sitting unsold for a while."", ""gt_url"": [""https://swappa.com/listings/samsung-galaxy-s24?condition=good&carrier=unlocked&color=black&storage=128gb&modeln=U00tUzkyMVUx&sort=listing_created_newest&accepts_stripe=on&phone_check_certified=on""], ""location"": ""United States"", ""timezone"": ""America/Los_Angeles"", ""url"": ""https://swappa.com/"", ""timestamp"": null, ""values"": {}}",real,swappa,e_commerce,condition_filter,hard,"On Swappa, navigate to the correct product page, then use sidebar filters (Condition, Carrier, Storage, Color, Sort). The URL uses path segments for product/carrier and query params for other filters.",50,validation,null
swappa/condition/8,"{""_target_"": ""navi_bench.swappa.swappa_url_match.generate_task_config"", ""task"": ""My cousin has been trying to avoid another expensive phone contract after paying off his previous device earlier this year, so he has been carefully comparing unlocked resale options that still feel premium enough to last several more years. Search for iPhone 14 Pro listings and filter for mint condition only because he wants something that still feels practically untouched. Select the unlocked models with the black color option as he likes to keep it low, the 128GB storage configuration so he can store all the dog memes he enjoys, and the A2650 variant as it fulfills his carrier flexibility while traveling internationally for work. Keep the results limited to listings that accept credit card payments and enable international shipping availability since he may end up purchasing the phone while overseas later this year. Sort the listings from highest price to lowest first so we can compare where the premium pricing starts becoming excessive compared to nearby listings with similar condition and configuration."", ""gt_url"": [""https://swappa.com/listings/apple-iphone-14-pro?condition=mint&carrier=unlocked&color=black&storage=128gb&modeln=QTI2NTA&sort=price_high&accepts_stripe=on&international=on""], ""location"": ""United States"", ""timezone"": ""America/Los_Angeles"", ""url"": ""https://swappa.com/"", ""timestamp"": null, ""values"": {}}",real,swappa,e_commerce,condition_filter,hard,"On Swappa, navigate to the correct product page, then use sidebar filters (Condition, Carrier, Storage, Color, Sort). The URL uses path segments for product/carrier and query params for other filters.",50,validation,null
swappa/condition/9,"{""_target_"": ""navi_bench.swappa.swappa_url_match.generate_task_config"", ""task"": ""My cousin has been trying to avoid another expensive phone contract after realizing how much he spent over the last few years constantly upgrading devices through installment plans. Search for Google Pixel 8 listings and filter for good condition only because he wants something dependable without paying close to flagship-new pricing. Select the Unlocked carrier option with the 128GB storage configuration, the G9BQD variant, and the Sub-6 5G edition as it would work best with his current carrier plan and coverage area. Keep the results limited to phonecheck certified listings that accept credit card payments and enable international shipping availability since he may end up using the phone while traveling overseas later this year. Sort the listings by oldest first because he wants to compare whether sellers with older unsold listings become more flexible on pricing compared to newly posted devices."", ""gt_url"": [""https://swappa.com/listings/google-pixel-8?condition=good&carrier=unlocked&storage=128gb&modeln=RzlCUUQ&edition=U3ViLTYgNUc&sort=listing_created_oldest&accepts_stripe=on&phone_check_certified=on&international=on""], ""location"": ""United States"", ""timezone"": ""America/Los_Angeles"", ""url"": ""https://swappa.com/"", ""timestamp"": null, ""values"": {}}",real,swappa,e_commerce,condition_filter,hard,"On Swappa, navigate to the correct product page, then use sidebar filters (Condition, Carrier, Storage, Color, Sort). The URL uses path segments for product/carrier and query params for other filters.",50,validation,null
swappa/storage/0,"{""_target_"": ""navi_bench.swappa.swappa_url_match.generate_task_config"", ""task"": ""My friend has been trying to move away from locked carrier contracts after realizing how much flexibility he loses whenever he travels or wants to switch plans, so this time he only wants an unlocked phone that can easily move between networks. Search for iPhone 15 listings and select the unlocked models with the green color option, the 256GB storage configuration, and the A2846 variant. Keep the results limited to phonecheck certified listings that accept credit card payments and enable international shipping availability since he travels abroad several times a year and may even need the phone shipped internationally. Sort the listings from lowest price to highest first so we can identify where the best overall value starts before the pricing begins climbing unnecessarily."", ""gt_url"": [""https://swappa.com/listings/apple-iphone-15?carrier=unlocked&color=green&storage=256gb&modeln=QTI4NDY&sort=price_low&accepts_stripe=on&phone_check_certified=on&international=on""], ""location"": ""United States"", ""timezone"": ""America/Los_Angeles"", ""url"": ""https://swappa.com/"", ""timestamp"": null, ""values"": {}}",real,swappa,e_commerce,storage_combo,hard,"On Swappa, navigate to the correct product page, then use sidebar filters (Condition, Carrier, Storage, Color, Sort). The URL uses path segments for product/carrier and query params for other filters.",50,validation,null
swappa/storage/1,"{""_target_"": ""navi_bench.swappa.swappa_url_match.generate_task_config"", ""task"": ""My friend has been planning to upgrade before a long international work trip, but he keeps overthinking whether spending more on a premium phone now will actually save him from needing another upgrade too soon. Search for iPhone 15 Pro Max listings and select the unlocked models with the blue color option and the 512GB storage configuration because he shoots a lot of high-resolution travel footage and does not want to constantly manage storage while abroad. Keep the results limited to phonecheck certified listings and international shipping availability enabled since he may end up purchasing the phone while traveling overseas later this year. Sort the listings from lowest price to highest first so we can compare where the best long-term value starts before the pricing begins climbing too aggressively."", ""gt_url"": [""https://swappa.com/listings/apple-iphone-15-pro-max?carrier=unlocked&color=blue&storage=512gb&sort=price_low&phone_check_certified=on&international=on""], ""location"": ""United States"", ""timezone"": ""America/Los_Angeles"", ""url"": ""https://swappa.com/"", ""timestamp"": null, ""values"": {}}",real,swappa,e_commerce,storage_combo,hard,"On Swappa, navigate to the correct product page, then use sidebar filters (Condition, Carrier, Storage, Color, Sort). The URL uses path segments for product/carrier and query params for other filters.",50,validation,null
