task_id,task_generation_config_json,env,domain,l1_category,l2_category,suggested_difficulty,suggested_hint,suggested_max_steps,suggested_split,metadata_json
swappa/product_nav/0,"{""_target_"": ""navi_bench.swappa.swappa_url_match.generate_task_config"", ""task"": ""My cousin has been saving up for months to finally upgrade his phone and has been looking forward to it. Search for iPhone 15 Pro listings and filter for mint condition only since he wants the phone looking as close to brand new as possible. Select the white color option, the 512GB storage model, and the A2848 variant because he spent a lot of time researching the exact version he wanted before finally deciding to upgrade. Keep the results limited to phonecheck certified listings that accept credit card payments so the purchase feels a little safer, and sort the listings from lowest price to highest first."", ""gt_url"": [""https://swappa.com/listings/apple-iphone-15-pro?condition=mint&color=white&storage=512gb&modeln=QTI4NDg&sort=price_low&accepts_stripe=on&phone_check_certified=on""], ""location"": ""United States"", ""timezone"": ""America/Los_Angeles"", ""url"": ""https://swappa.com/"", ""timestamp"": null, ""values"": {}}",real,swappa,e_commerce,product_navigation,hard,"On Swappa, navigate to the correct product page, then use sidebar filters (Condition, Carrier, Storage, Color, Sort). The URL uses path segments for product/carrier and query params for other filters.",50,validation,null
swappa/product_nav/1,"{""_target_"": ""navi_bench.swappa.swappa_url_match.generate_task_config"", ""task"": ""One of my friends has been trying to replace his old phone so search for Samsung Galaxy S24 Ultra listings and filter for good condition with the 256GB storage option since he mainly just wants something reliable without paying flagship-new prices. Make sure the results stay narrowed down to the SM-S928U1 variant because that is the exact model version he checked compatibility for before planning the purchase. Keep the results limited to phonecheck certified listings and enable international shipping availability because he may end up ordering it while traveling overseas. Sort the listings by newest first so we can check the freshest listings before older ones disappear."", ""gt_url"": [""https://swappa.com/listings/samsung-galaxy-s24-ultra?condition=good&storage=256gb&modeln=U00tUzkyOFUx&sort=listing_created_newest&phone_check_certified=on&international=on""], ""location"": ""United States"", ""timezone"": ""America/Los_Angeles"", ""url"": ""https://swappa.com/"", ""timestamp"": null, ""values"": {}}",real,swappa,e_commerce,product_navigation,hard,"On Swappa, navigate to the correct product page, then use sidebar filters (Condition, Carrier, Storage, Color, Sort). The URL uses path segments for product/carrier and query params for other filters.",50,validation,null
swappa/product_nav/2,"{""_target_"": ""navi_bench.swappa.swappa_url_match.generate_task_config"", ""task"": ""My friend has been slowly saving for a phone upgrade by putting aside around 15% of every paycheck since the start of the year, and now he finally wants to replace his aging Pixel before the battery gives out completely. Search for Google Pixel 8 Pro listings and filter for good condition because he cares more about value than paying extra for a mint device. Select the T-Mobile carrier option, the Obsidian color, the 256GB storage model, and the G1MNW variant since that is the exact configuration he has been planning around after comparing different Pixel versions online. Make sure the results stay limited to the mmWave 5G edition because he specifically wants the faster connectivity version for long-term use. Keep the results limited to phonecheck certified listings that accept credit card payments because he wants the buying process to feel more secure, and sort the listings from lowest price to highest first."", ""gt_url"": [""https://swappa.com/listings/google-pixel-8-pro?condition=good&carrier=t-mobile&color=obsidian&storage=256gb&modeln=RzFNTlc&edition=bW1XYXZlIDVH&sort=price_low&accepts_stripe=on&phone_check_certified=on""], ""location"": ""United States"", ""timezone"": ""America/Los_Angeles"", ""url"": ""https://swappa.com/"", ""timestamp"": null, ""values"": {}}",real,swappa,e_commerce,product_navigation,hard,"On Swappa, navigate to the correct product page, then use sidebar filters (Condition, Carrier, Storage, Color, Sort). The URL uses path segments for product/carrier and query params for other filters.",50,validation,null
swappa/product_nav/3,"{""_target_"": ""navi_bench.swappa.swappa_url_match.generate_task_config"", ""task"": ""My friend has been freelancing on the side for months and finally wants to buy an iPad for design work instead of constantly borrowing one from his office. Search for the 12.9-inch iPad Pro 6th Gen 2022 listings and filter for good condition only since he is trying to maximize value instead of paying extra for a mint device. Select the unlocked models with the 256GB storage option in Gray because he wants something flexible enough to use while traveling and working remotely. Keep business sellers excluded because he feels more comfortable negotiating with individual sellers directly, and sort the listings from lowest price to highest first."", ""gt_url"": [""https://swappa.com/listings/apple-ipad-pro-129-6th-gen-2022?condition=good&carrier=unlocked&color=space-gray&storage=256gb&sort=price_low&exclude_businesses=on""], ""location"": ""United States"", ""timezone"": ""America/Los_Angeles"", ""url"": ""https://swappa.com/"", ""timestamp"": null, ""values"": {}}",real,swappa,e_commerce,product_navigation,hard,"On Swappa, navigate to the correct product page, then use sidebar filters (Condition, Carrier, Storage, Color, Sort). The URL uses path segments for product/carrier and query params for other filters.",50,validation,null
swappa/product_nav/4,"{""_target_"": ""navi_bench.swappa.swappa_url_match.generate_task_config"", ""task"": ""My friend has been planning to replace his old laptop before starting a new editing job, but he made a deal with himself that the upgrade has to stay financially smarter than buying directly from retail. Search for the MacBook Air 2023 (M2) 15-inch listings and filter for mint condition only since he wants something that still feels practically untouched. Select the Gray color with the 1TB storage option, 24GB memory configuration, and the Apple M2 processor because he plans to use it for heavier creative work and multitasking. Keep business sellers excluded because he prefers dealing directly with individual owners, and sort the listings from lowest price to highest first."", ""gt_url"": [""https://swappa.com/listings/apple-macbook-air-2023-15?condition=mint&color=space-gray&storage=1tb&memory=24gb&processor=apple-m2&sort=price_low&exclude_businesses=on""], ""location"": ""United States"", ""timezone"": ""America/Los_Angeles"", ""url"": ""https://swappa.com/"", ""timestamp"": null, ""values"": {}}",real,swappa,e_commerce,product_navigation,hard,"On Swappa, navigate to the correct product page, then use sidebar filters (Condition, Carrier, Storage, Color, Sort). The URL uses path segments for product/carrier and query params for other filters.",50,validation,null
swappa/product_nav/5,"{""_target_"": ""navi_bench.swappa.swappa_url_match.generate_task_config"", ""task"": ""My uncle has been trying to get back into running and fitness lately, so the family decided to split the cost of an Apple Watch for his birthday instead of buying random gifts he will never use. Search for Apple Watch Series 8 41mm listings and look for the unlocked cellular models because he travels a lot for work and does not want to stay tied to one carrier. Make sure the results stay narrowed down to the A2772 Cellular variant since that is the exact version my cousin already checked for carrier flexibility and travel use. Keep business sellers excluded because everyone would rather compare listings from individual owners instead of storefront accounts, and sort the results from highest price to lowest first so we can evaluate the premium listings before deciding where it actually stops being worth paying extra."", ""gt_url"": [""https://swappa.com/listings/apple-watch-series-8-41mm?carrier=unlocked&modeln=QTI3NzIgLSBDZWxsdWxhcg&sort=price_high&exclude_businesses=on""], ""location"": ""United States"", ""timezone"": ""America/Los_Angeles"", ""url"": ""https://swappa.com/"", ""timestamp"": null, ""values"": {}}",real,swappa,e_commerce,product_navigation,hard,"On Swappa, navigate to the correct product page, then use sidebar filters (Condition, Carrier, Storage, Color, Sort). The URL uses path segments for product/carrier and query params for other filters.",50,validation,null
swappa/product_nav/6,"{""_target_"": ""navi_bench.swappa.swappa_url_match.generate_task_config"", ""task"": ""My cousin has been planning to surprise his wife with a phone upgrade for their anniversary, but he is trying to be smart about it because they already spent a lot on vacation bookings this month. Search for iPhone 14 Pro listings and look for good condition only since he cares more about getting strong value than paying extra for a flawless device. Select the unlocked models with the gold color option, the 512GB storage configuration, and the A2650 variant because she stores years of photos and videos directly on her phone and he already confirmed that exact version would work best for their travel plans. Keep the results limited to phonecheck certified listings with international availability enabled since they may end up buying it while traveling, and sort the listings from highest price to lowest first so we can figure out where the pricing starts becoming unreasonable."", ""gt_url"": [""https://swappa.com/listings/apple-iphone-14-pro?condition=good&carrier=unlocked&color=gold&storage=512gb&modeln=QTI2NTA&sort=price_high&phone_check_certified=on&international=on""], ""location"": ""United States"", ""timezone"": ""America/Los_Angeles"", ""url"": ""https://swappa.com/"", ""timestamp"": null, ""values"": {}}",real,swappa,e_commerce,product_navigation,hard,"On Swappa, navigate to the correct product page, then use sidebar filters (Condition, Carrier, Storage, Color, Sort). The URL uses path segments for product/carrier and query params for other filters.",50,validation,null
swappa/product_nav/7,"{""_target_"": ""navi_bench.swappa.swappa_url_match.generate_task_config"", ""task"": ""My friend has been using the same cracked phone for almost four years now, so everyone in our group decided to chip in and help him upgrade before his wedding later this year. Search for Samsung Galaxy S23 Ultra listings and filter for good condition only since nobody wants to overspend on a device that is mainly meant to be a practical long-term upgrade. Select the AT&T carrier option, the black color variant, the 512GB storage model, and the SM-S918U1 version because he specifically wanted the exact variant he had been comparing for work and travel compatibility. Keep the results limited to phonecheck certified listings with international shipping availability enabled since he travels frequently for work, and sort the listings from highest price to lowest first so we can see where the premium pricing starts tapering off."", ""gt_url"": [""https://swappa.com/listings/samsung-galaxy-s23-ultra?condition=good&carrier=att&color=black&storage=512gb&modeln=U00tUzkxOFUx&sort=price_high&phone_check_certified=on&international=on""], ""location"": ""United States"", ""timezone"": ""America/Los_Angeles"", ""url"": ""https://swappa.com/"", ""timestamp"": null, ""values"": {}}",real,swappa,e_commerce,product_navigation,hard,"On Swappa, navigate to the correct product page, then use sidebar filters (Condition, Carrier, Storage, Color, Sort). The URL uses path segments for product/carrier and query params for other filters.",50,validation,null
swappa/product_nav/8,"{""_target_"": ""navi_bench.swappa.swappa_url_match.generate_task_config"", ""task"": ""I’ve been looking for a solid pair of AirPods Pro 2 lately because my current earbuds barely hold a charge anymore. Search for Apple AirPods Pro 2 listings and filter for used condition because I would rather save some money than pay full price for a sealed pair. Select the Lightning edition specifically so I do not end up owning the newer USB-C version by mistake. Enable international shipping availability since I may need them shipped while I am overseas, and sort the listings from highest price to lowest first because I want to compare the more premium listings before deciding whether the extra cost actually feels justified compared to the cheaper options further down."", ""gt_url"": [""https://swappa.com/listings/apple-airpods-pro-2nd-gen?condition=used&edition=TGlnaHRuaW5n&sort=price_high&international=on""], ""location"": ""United States"", ""timezone"": ""America/Los_Angeles"", ""url"": ""https://swappa.com/"", ""timestamp"": null, ""values"": {}}",real,swappa,e_commerce,product_navigation,hard,"On Swappa, navigate to the correct product page, then use sidebar filters (Condition, Carrier, Storage, Color, Sort). The URL uses path segments for product/carrier and query params for other filters.",50,validation,null
swappa/product_nav/9,"{""_target_"": ""navi_bench.swappa.swappa_url_match.generate_task_config"", ""task"": ""My younger cousin has been begging for a Nintendo Switch OLED ever since he started commuting long hours to college, so the family agreed to help him buy one if he could stick to the savings challenge we gave him earlier this year. Search for Nintendo Switch OLED listings and look for mint condition only because he has a habit of keeping his gadgets in perfect shape and wants something that still feels brand new. Select the red and blue color option with the 64GB storage model because that is the exact setup he originally picked out after comparing the different console versions online. Keep business sellers excluded since his parents would rather buy from individual sellers instead of storefront accounts, and sort the listings from lowest price to highest first so we can compare the better deals early on."", ""gt_url"": [""https://swappa.com/listings/nintendo-switch-oled?condition=mint&color=red-blue&storage=64gb&sort=price_low&exclude_businesses=on""], ""location"": ""United States"", ""timezone"": ""America/Los_Angeles"", ""url"": ""https://swappa.com/"", ""timestamp"": null, ""values"": {}}",real,swappa,e_commerce,product_navigation,hard,"On Swappa, navigate to the correct product page, then use sidebar filters (Condition, Carrier, Storage, Color, Sort). The URL uses path segments for product/carrier and query params for other filters.",50,validation,null
swappa/carrier/0,"{""_target_"": ""navi_bench.swappa.swappa_url_match.generate_task_config"", ""task"": ""My older brother wants to keep his current phone for at least another three years, so he has been obsessing over finding a deal that actually makes sense long term instead of just grabbing the cheapest option available. Search for iPhone 11 Pro Max listings and select the unlocked models in green with the 64GB storage option since he mainly uses cloud storage anyway and prefers the smaller price difference. Make sure the results stay narrowed down to the A2161 variant because he specifically checked compatibility and repair part availability for that exact version before deciding to upgrade. Keep the results limited to listings that accept credit card payments and enable international shipping availability because he travels outside the country frequently for work. Sort the listings from highest price to lowest first so we can figure out whether the more expensive listings are actually worth paying extra for."", ""gt_url"": [""https://swappa.com/listings/apple-iphone-11-pro-max?carrier=unlocked&color=green&storage=64gb&modeln=QTIxNjE&sort=price_high&accepts_stripe=on&international=on""], ""location"": ""United States"", ""timezone"": ""America/Los_Angeles"", ""url"": ""https://swappa.com/"", ""timestamp"": null, ""values"": {}}",real,swappa,e_commerce,carrier_selection,hard,"On Swappa, navigate to the correct product page, then use sidebar filters (Condition, Carrier, Storage, Color, Sort). The URL uses path segments for product/carrier and query params for other filters.",50,validation,null
swappa/carrier/1,"{""_target_"": ""navi_bench.swappa.swappa_url_match.generate_task_config"", ""task"": ""My friend has been trying to cut down on unnecessary spending this year, so he made a rule for himself that every major purchase has to earn its value compared to how long he realistically plans to keep it. Search for Samsung Galaxy S24 listings and filter for good condition only since he wants a balance between price and longevity instead of paying full flagship prices. Select the AT&T carrier option with the black color variant, the 128GB storage model, and the SM-S921U1 version because he already checked that exact variant for compatibility with his current setup. Keep the results limited to phonecheck certified listings that accept credit card payments so the purchase feels safer overall, and sort the listings from highest price to lowest first so we can judge where the premium pricing starts becoming excessive."", ""gt_url"": [""https://swappa.com/listings/samsung-galaxy-s24?condition=good&carrier=att&color=black&storage=128gb&modeln=U00tUzkyMVUx&sort=price_high&accepts_stripe=on&phone_check_certified=on""], ""location"": ""United States"", ""timezone"": ""America/Los_Angeles"", ""url"": ""https://swappa.com/"", ""timestamp"": null, ""values"": {}}",real,swappa,e_commerce,carrier_selection,hard,"On Swappa, navigate to the correct product page, then use sidebar filters (Condition, Carrier, Storage, Color, Sort). The URL uses path segments for product/carrier and query params for other filters.",50,validation,null
swappa/carrier/2,"{""_target_"": ""navi_bench.swappa.swappa_url_match.generate_task_config"", ""task"": ""My sister has been holding onto her old phone for way longer than she planned because she wanted to save enough money to buy the next one outright instead of touching her emergency savings. Search for iPhone 15 Pro listings and narrow the results down to devices in good condition because she wants something that still feels reliable and well-maintained. Select the unlocked models with the blue color option, the 256GB storage configuration, and the A2848 variant because she specifically researched that exact version before deciding to upgrade. Keep the results limited to listings that accept credit card payments and enable international shipping availability because she may end up buying it while traveling abroad later this year. Compare the listings based on how much extra each seller is charging relative to nearby listings with similar condition and configuration, since she only wants to pay a premium if the difference actually feels justified by the overall value of the listing and sort the results by lowest price first."", ""gt_url"": [""https://swappa.com/listings/apple-iphone-15-pro?condition=good&carrier=unlocked&color=blue&storage=256gb&modeln=QTI4NDg&sort=price_low&accepts_stripe=on&international=on""], ""location"": ""United States"", ""timezone"": ""America/Los_Angeles"", ""url"": ""https://swappa.com/"", ""timestamp"": null, ""values"": {}}",real,swappa,e_commerce,carrier_selection,hard,"On Swappa, navigate to the correct product page, then use sidebar filters (Condition, Carrier, Storage, Color, Sort). The URL uses path segments for product/carrier and query params for other filters.",50,validation,null
swappa/carrier/3,"{""_target_"": ""navi_bench.swappa.swappa_url_match.generate_task_config"", ""task"": ""My cousin has been trying to stop impulse-buying tech this year, so instead of ordering the first decent phone he sees, he started tracking how quickly newly listed devices drop in price during their first few days on resale sites. Search for Google Pixel 8 listings and filter for good condition only since he still wants solid value without paying close to retail pricing. Select the T-Mobile carrier option with the Hazel color variant, the 256GB storage model, the G9BQD variant, and the Sub-6 5G edition because that is the exact setup he has been waiting for after comparing several Pixel configurations online. Keep the results limited to phonecheck certified listings that accept credit card payments, and sort the listings by newest first so we can monitor the freshest postings before sellers begin lowering prices over time."", ""gt_url"": [""https://swappa.com/listings/google-pixel-8?condition=good&carrier=t-mobile&color=hazel&storage=256gb&modeln=RzlCUUQ&edition=U3ViLTYgNUc&sort=listing_created_newest&accepts_stripe=on&phone_check_certified=on""], ""location"": ""United States"", ""timezone"": ""America/Los_Angeles"", ""url"": ""https://swappa.com/"", ""timestamp"": null, ""values"": {}}",real,swappa,e_commerce,carrier_selection,hard,"On Swappa, navigate to the correct product page, then use sidebar filters (Condition, Carrier, Storage, Color, Sort). The URL uses path segments for product/carrier and query params for other filters.",50,validation,null
swappa/carrier/4,"{""_target_"": ""navi_bench.swappa.swappa_url_match.generate_task_config"", ""task"": ""My friend has been trying to become more disciplined with big purchases, so before upgrading his phone he started comparing how much value he would realistically get per year instead of just looking at the upfront price. Search for Samsung Galaxy S23 Ultra listings and filter for mint condition only because he wants something that still feels as close to new as possible. Select the unlocked models with the black color option, the 256GB storage configuration, and the SM-S918U1 variant since that is the exact version he narrowed down after checking long-term carrier flexibility and resale value. Keep the results limited to phonecheck certified listings that accept credit card payments so the transaction feels more secure, and sort the listings from highest price to lowest first so we can see where the premium pricing starts losing value."", ""gt_url"": [""https://swappa.com/listings/samsung-galaxy-s23-ultra?condition=mint&carrier=unlocked&color=black&storage=256gb&modeln=U00tUzkxOFUx&sort=price_high&accepts_stripe=on&phone_check_certified=on""], ""location"": ""United States"", ""timezone"": ""America/Los_Angeles"", ""url"": ""https://swappa.com/"", ""timestamp"": null, ""values"": {}}",real,swappa,e_commerce,carrier_selection,hard,"On Swappa, navigate to the correct product page, then use sidebar filters (Condition, Carrier, Storage, Color, Sort). The URL uses path segments for product/carrier and query params for other filters.",50,validation,null
swappa/carrier/5,"{""_target_"": ""navi_bench.swappa.swappa_url_match.generate_task_config"", ""task"": ""One of my relatives has been trying to replace her old phone before a long overseas work assignment, but she keeps delaying the purchase because she wants something reliable enough to last the entire contract without needing another upgrade halfway through. Search for iPhone 14 Pro Max listings and look for mint condition only since she does not want to risk dealing with cosmetic wear or battery issues while living abroad. Select the AT&T carrier option with the gold color variant, the 128GB storage configuration, and the A2651 model because that is the exact version she already checked for compatibility with her current plan and travel setup. Keep the results limited to listings that accept credit card payments and enable international shipping availability since she may need the device shipped to her while she is overseas. Sort the listings by oldest first because she suspects sellers with older unsold listings may be more flexible on pricing compared to newer postings that were just added recently."", ""gt_url"": [""https://swappa.com/listings/apple-iphone-14-pro-max?condition=mint&carrier=att&color=gold&storage=128gb&modeln=QTI2NTE&sort=listing_created_oldest&accepts_stripe=on&international=on""], ""location"": ""United States"", ""timezone"": ""America/Los_Angeles"", ""url"": ""https://swappa.com/"", ""timestamp"": null, ""values"": {}}",real,swappa,e_commerce,carrier_selection,hard,"On Swappa, navigate to the correct product page, then use sidebar filters (Condition, Carrier, Storage, Color, Sort). The URL uses path segments for product/carrier and query params for other filters.",50,validation,null
